{
  "$schema": "../schemas/asset-catalog.schema.json",
  "schemaVersion": 1,
  "catalogVersion": "0.1.0",
  "status": "design-complete-runtime-pending",
  "resolverOrder": ["authored", "proceduralFallback", "primitiveFallback", "diagnosticMarker"],
  "roots": {
    "models": "assets/models/",
    "textures": "assets/textures/",
    "audio": "assets/audio/",
    "ui": "assets/ui/",
    "licenses": "assets/licenses/"
  },
  "licensePolicy": {
    "externalAssetsRequireLicenseEntry": true,
    "hotlinkingAllowed": false,
    "preferredLicenses": ["CC0", "project-owned"],
    "licenseFileConvention": "assets/licenses/<pack-id>/LICENSE.txt"
  },
  "conventions": {
    "worldUp": "Y",
    "forward": "+Z",
    "unitMeters": 1,
    "roomSurfaceY": 0,
    "characterSocketContract": ["root", "pelvis", "chest", "head", "headTop", "handL", "handR", "shoulderL", "shoulderR", "back", "waistFront", "waistBack", "baseFx"],
    "requiredVariants": ["default", "damaged"],
    "recommendedVariants": ["occupied", "ruined", "burned", "infested"]
  },
  "performanceBudgets": {
    "desktopHeroDioramaTriangles": 75000,
    "mobileHeroDioramaTriangles": 28000,
    "desktopRoomKitTextureSize": 2048,
    "mobileRoomKitTextureSize": 1024,
    "maximumDynamicLightsPerVisibleRoom": 3,
    "maximumParticlesPerVisibleRoomMobile": 80
  },
  "templates": {
    "zone-kit": {
      "kind": "environment-kit",
      "proceduralFallback": { "factory": "CampaignZoneFallbackFactory", "recipeFromId": true },
      "primitiveFallback": "diagnostic.room-kit"
    },
    "campaign-landmark": {
      "kind": "diorama",
      "proceduralFallback": { "factory": "CampaignLandmarkFallbackFactory", "recipeFromId": true },
      "primitiveFallback": "diagnostic.landmark",
      "defaultFootprint": { "radius": 1.8 }
    },
    "facility": {
      "kind": "diorama",
      "proceduralFallback": { "factory": "FacilityAssetFactory", "recipeFromId": true },
      "primitiveFallback": "diagnostic.facility"
    },
    "settlement-structure": {
      "kind": "destructible-diorama",
      "proceduralFallback": { "factory": "Phase8DAssetFactory", "recipeFromId": true },
      "primitiveFallback": "diagnostic.structure"
    }
  },
  "entries": [
    { "id": "diagnostic.room-kit", "kind": "diagnostic", "status": "active-procedural", "priority": "P0", "proceduralFallback": { "factory": "DiagnosticAssetFactory", "recipe": "roomKit" } },
    { "id": "diagnostic.landmark", "kind": "diagnostic", "status": "active-procedural", "priority": "P0", "proceduralFallback": { "factory": "DiagnosticAssetFactory", "recipe": "landmark" } },
    { "id": "diagnostic.facility", "kind": "diagnostic", "status": "active-procedural", "priority": "P0", "proceduralFallback": { "factory": "DiagnosticAssetFactory", "recipe": "facility" } },
    { "id": "diagnostic.structure", "kind": "diagnostic", "status": "active-procedural", "priority": "P0", "proceduralFallback": { "factory": "DiagnosticAssetFactory", "recipe": "structure" } },

    { "id": "environment.room-floor", "kind": "environment-module", "status": "upgrade", "priority": "P0", "authored": { "model": "assets/models/environment/common/room-floor.glb" }, "proceduralFallback": { "factory": "AssetRegistry", "recipe": "makeRoomFloor" }, "variants": ["stone", "wood", "metal", "wet", "organic"] },
    { "id": "environment.wall-segment", "kind": "environment-module", "status": "upgrade", "priority": "P0", "authored": { "model": "assets/models/environment/common/wall-segment.glb" }, "proceduralFallback": { "factory": "AssetRegistry", "recipe": "makeWallSegment" }, "variants": ["straight", "corner", "cracked", "mossy"] },
    { "id": "environment.door-frame", "kind": "environment-module", "status": "upgrade", "priority": "P0", "authored": { "model": "assets/models/environment/common/door-frame.glb" }, "proceduralFallback": { "factory": "AssetRegistry", "recipe": "makeDoorFrame" }, "variants": ["open", "closed", "locked", "broken", "faction-marked"] },
    { "id": "environment.corridor", "kind": "environment-module", "status": "upgrade", "priority": "P0", "authored": { "model": "assets/models/environment/common/corridor.glb" }, "proceduralFallback": { "factory": "AssetRegistry", "recipe": "makeCorridorSegment" }, "variants": ["stone", "drain", "collapsed", "webbed"] },

    { "id": "facility.expedition-gate", "template": "facility", "status": "upgrade", "priority": "P0", "authored": { "model": "assets/models/props/facilities/expedition-gate.glb" }, "proceduralFallback": { "factory": "FacilityAssetFactory", "recipe": "createDungeonEntrance" }, "footprint": { "radius": 1.25 } },
    { "id": "facility.water-fountain", "template": "facility", "status": "upgrade", "priority": "P0", "authored": { "model": "assets/models/props/facilities/water-fountain.glb" }, "proceduralFallback": { "factory": "FacilityAssetFactory", "recipe": "createWaterFountain" }, "footprint": { "radius": 0.85 } },
    { "id": "facility.rest-site", "template": "facility", "status": "content", "priority": "P0", "authored": { "model": "assets/models/props/facilities/rest-site.glb" }, "proceduralFallback": { "factory": "FacilityAssetFactory", "recipe": "createRestSite" }, "footprint": { "radius": 1.15 } },
    { "id": "facility.field-camp", "template": "facility", "status": "active-procedural", "priority": "P0", "authored": { "model": "assets/models/props/facilities/field-camp.glb" }, "proceduralFallback": { "factory": "ExpeditionAssetFactory", "recipe": "createFieldCamp" }, "footprint": { "radius": 1.4 }, "variants": ["bivouac", "camp", "damaged", "abandoned"] },
    { "id": "facility.merchant-stall", "template": "facility", "status": "upgrade", "priority": "P1", "authored": { "model": "assets/models/props/facilities/merchant-stall.glb" }, "proceduralFallback": { "factory": "FacilityAssetFactory", "recipe": "createMerchantStall" }, "footprint": { "radius": 1.2 } },
    { "id": "facility.goddess-statue", "template": "facility", "status": "author", "priority": "P1", "authored": { "model": "assets/models/props/facilities/goddess-statue.glb" }, "proceduralFallback": { "factory": "FacilityAssetFactory", "recipe": "createGoddessStatue" }, "footprint": { "radius": 1.0 }, "variants": ["charged", "depleted", "defiled"] },

    { "id": "settlement.supply-depot", "template": "settlement-structure", "status": "active-procedural", "priority": "P0", "authored": { "model": "assets/models/props/settlements/supply-depot.glb" }, "proceduralFallback": { "factory": "Phase8DAssetFactory", "recipe": "createSupplyDepot" }, "footprint": { "radius": 1.2 }, "variants": ["building", "complete", "damaged", "destroyed"] },
    { "id": "settlement.gatehouse", "template": "settlement-structure", "status": "upgrade", "priority": "P1", "authored": { "model": "assets/models/props/settlements/gatehouse.glb" }, "proceduralFallback": { "factory": "Phase8DAssetFactory", "recipe": "createGatehouse" }, "footprint": { "radius": 1.45 }, "variants": ["building", "complete", "breached", "destroyed"] },
    { "id": "settlement.siege-workshop", "template": "settlement-structure", "status": "upgrade", "priority": "P1", "authored": { "model": "assets/models/props/settlements/siege-workshop.glb" }, "proceduralFallback": { "factory": "Phase8DAssetFactory", "recipe": "createSiegeWorkshop" }, "footprint": { "radius": 1.3 } },
    { "id": "settlement.ambush-post", "template": "settlement-structure", "status": "active-procedural", "priority": "P1", "authored": { "model": "assets/models/props/settlements/ambush-post.glb" }, "proceduralFallback": { "factory": "Phase8DAssetFactory", "recipe": "createAmbushPost" }, "footprint": { "radius": 0.95 } },

    { "id": "habitat.goblin-hearth", "kind": "habitat", "status": "upgrade", "priority": "P1", "authored": { "model": "assets/models/props/habitats/goblin-hearth.glb" }, "proceduralFallback": { "factory": "EcologyAssetFactory", "recipe": "goblinLair" } },
    { "id": "habitat.ossuary", "kind": "habitat", "status": "upgrade", "priority": "P1", "authored": { "model": "assets/models/props/habitats/ossuary.glb" }, "proceduralFallback": { "factory": "EcologyAssetFactory", "recipe": "ossuaryLair" } },
    { "id": "habitat.spider-brood", "kind": "habitat", "status": "author", "priority": "P1", "authored": { "model": "assets/models/props/habitats/spider-brood.glb" }, "proceduralFallback": { "factory": "EcologyAssetFactory", "recipe": "spiderLair" } },
    { "id": "habitat.slime-pool", "kind": "habitat", "status": "upgrade", "priority": "P1", "authored": { "model": "assets/models/props/habitats/slime-pool.glb" }, "proceduralFallback": { "factory": "EcologyAssetFactory", "recipe": "slimePool" } },
    { "id": "habitat.rat-warren", "kind": "habitat", "status": "active-procedural", "priority": "P1", "authored": { "model": "assets/models/props/habitats/rat-warren.glb" }, "proceduralFallback": { "factory": "EcologyAssetFactory", "recipe": "ratWarren" } },
    { "id": "habitat.ogre-butcher", "kind": "habitat", "status": "upgrade", "priority": "P1", "authored": { "model": "assets/models/props/habitats/ogre-butcher.glb" }, "proceduralFallback": { "factory": "EcologyAssetFactory", "recipe": "ogreLair" } },
    { "id": "habitat.plague-mortuary", "kind": "habitat", "status": "upgrade", "priority": "P1", "authored": { "model": "assets/models/props/habitats/plague-mortuary.glb" }, "proceduralFallback": { "factory": "AdvancedLairAssetFactory", "recipe": "plagueMortuary" } },
    { "id": "habitat.orc-war-camp", "kind": "habitat", "status": "upgrade", "priority": "P1", "authored": { "model": "assets/models/props/habitats/orc-war-camp.glb" }, "proceduralFallback": { "factory": "AdvancedLairAssetFactory", "recipe": "orcTribeCamp" } },
    { "id": "habitat.fungal-colony", "kind": "habitat", "status": "author", "priority": "P1", "authored": { "model": "assets/models/props/habitats/fungal-colony.glb" }, "proceduralFallback": { "factory": "AdvancedLairAssetFactory", "recipe": "fungalGarden" } },